"#","Catégorie","Nom","Affiliation / contexte","Persona joueur","Partie 1 (Camp · Figure · Mode → Issue)","Partie 2","Partie 3","Verdict après plays"
"97","Artiste 2026","Hito Steyerl","Théoricienne-artiste — image et capital","Image et capital","Patron · Parisot · Réfléchi → 2008","","","Le pouvoir de l'image (presse, télé) est sous-traité dans le rapport de force"
"98","Futurologue","Yuval Noah Harari","Hebrew U — Sapiens, Homo Deus","Long terme et IA","Salarié · Berger · Réfléchi → 2016","Patron · Roux de Bézieux · Réfléchi → 2017","","La menace IA sur le travail (2030+) doit être un tour-pivot ajouté"
"99","Futurologue","Kevin Kelly","ex-Wired — The Inevitable","Trajectoires technologiques","Patron · Roux de Bézieux · Réfléchi → 2017","","","Le 'cogentif' (cogestion + IA) est l'avenir ; le jeu pourrait le préfigurer"
"100","Futurologue","Amy Webb","Future Today Institute","Futures quantitatifs","Salarié · Léon · Réfléchi → 2024","Patron · Martin · Réfléchi → 2024","","Les signaux faibles 2025-2030 (plateformes, télétravail) à amplifier"
"101","Futurologue","Cécile Wendling","Sciences Po — prospective","Prospective française","Salarié · Léon · Réfléchi","Patron · Carlac'h · Réfléchi","","Excellent matériau pour atelier de prospective syndicale ; en faire un kit"
"102","Futurologue","Stewart Brand","Whole Earth, Long Now","Pensée long terme","Salarié · Bouvier · Réfléchi → mutualité 1900","Patron · Schneider · Réfléchi → industrie XIXe","","Le 'long now' du paritarisme (1789-2026) est juste ; ajouter un horizon 2050"
